{
  "$schema": "https://json-schema.org/draft/2020-12/schema",
  "$id": "urn:image-prompt-registry:prompt:v1",
  "title": "Image Prompt Registry record",
  "description": "A normalized image-prompt record published under registry schema version 1.",
  "type": "object",
  "additionalProperties": false,
  "required": [
    "id",
    "sourceId",
    "title",
    "prompt",
    "description",
    "coverUrl",
    "referenceImageUrls",
    "tags",
    "author",
    "sourceUrl",
    "createdAt",
    "imageMode",
    "imageModel"
  ],
  "$defs": {
    "httpUrl": {
      "type": "string",
      "pattern": "^https?://",
      "description": "An absolute HTTP or HTTPS URL."
    }
  },
  "properties": {
    "id": {
      "type": "string",
      "pattern": "^[a-z0-9-]+:[a-f0-9]{16}$",
      "description": "Stable record identifier formed from the source ID and a truncated SHA-256 digest.",
      "examples": ["example-source:0123456789abcdef"]
    },
    "sourceId": {
      "type": "string",
      "pattern": "^[a-z0-9-]+$",
      "description": "Source identifier declared in sources.json.",
      "examples": ["example-source"]
    },
    "title": {
      "type": "string",
      "minLength": 1,
      "description": "Non-empty, single-line display title."
    },
    "prompt": {
      "type": "string",
      "minLength": 1,
      "description": "Normalized prompt body with LF line endings."
    },
    "description": {
      "type": "string",
      "description": "Optional explanatory text; an empty string means unavailable."
    },
    "coverUrl": {
      "description": "Absolute preview-image URL, or an empty string when unavailable.",
      "anyOf": [
        { "const": "" },
        { "$ref": "#/$defs/httpUrl" }
      ]
    },
    "referenceImageUrls": {
      "type": "array",
      "description": "Ordered unique absolute reference-image URLs.",
      "items": { "$ref": "#/$defs/httpUrl" },
      "uniqueItems": true
    },
    "tags": {
      "type": "array",
      "description": "Ordered unique source-provided classification labels.",
      "items": { "type": "string", "minLength": 1 },
      "uniqueItems": true
    },
    "author": {
      "type": "string",
      "description": "Upstream author or attribution label; an empty string means unavailable."
    },
    "sourceUrl": {
      "$ref": "#/$defs/httpUrl",
      "description": "Original record URL, falling back to the source homepage."
    },
    "createdAt": {
      "description": "Upstream date as YYYY-MM-DD, an RFC 3339 date-time with an explicit offset, or an empty string.",
      "oneOf": [
        { "const": "" },
        {
          "type": "string",
          "pattern": "^\\d{4}-\\d{2}-\\d{2}$",
          "format": "date"
        },
        {
          "type": "string",
          "pattern": "^\\d{4}-\\d{2}-\\d{2}T\\d{2}:\\d{2}:\\d{2}(?:\\.\\d+)?(?:Z|[+-]\\d{2}:\\d{2})$",
          "format": "date-time"
        }
      ]
    },
    "imageMode": {
      "type": "string",
      "enum": ["", "generate", "edit"],
      "description": "Whether the upstream prompt generates a new image, edits an input, or leaves the mode unspecified."
    },
    "imageModel": {
      "type": "string",
      "description": "Opaque upstream model identifier; an empty string means unspecified."
    },
    "imageSize": {
      "type": "string",
      "minLength": 1,
      "description": "Optional upstream image size or aspect-ratio label."
    },
    "imageCount": {
      "type": "integer",
      "minimum": 1,
      "description": "Optional positive requested or produced image count."
    }
  },
  "examples": [
    {
      "id": "example-source:0123456789abcdef",
      "sourceId": "example-source",
      "title": "Editorial product portrait",
      "prompt": "Create an editorial product portrait with soft window light.",
      "description": "",
      "coverUrl": "https://example.com/cover.jpg",
      "referenceImageUrls": [],
      "tags": ["editorial", "portrait"],
      "author": "Example Author",
      "sourceUrl": "https://example.com/original-prompt",
      "createdAt": "2026-08-11",
      "imageMode": "generate",
      "imageModel": "gpt-image-2"
    }
  ]
}
