[
  {
    "id": "youmind-nano-banana-pro:bc421cca0e220342",
    "sourceId": "youmind-nano-banana-pro",
    "title": "带肖像和中英文定制的宽引言卡",
    "prompt": "一张宽幅引言卡片，上面印有一位名人，背景为棕色，引言文字为浅金色衬线字体：“{argument name=\"famous_quote\" default=\"Stay Hungry, Stay Foolish\"}”，下方是较小的文字：“—{argument name=\"author\" default=\"Steve Jobs\"}”。文字前面有一个大而柔和的引号。人物肖像在左侧，文字在右侧。文字占据图片的三分之二，肖像占据三分之一，肖像部分带有轻微的渐变过渡效果。",
    "description": "一个用于生成宽幅引言卡的提示，卡片上有一位名人的肖像，背景为棕色，引言文字为浅金色衬线字体。布局为文字占据三分之二，人物占据三分之一。引言文字和作者可参数化以便重复使用。",
    "coverUrl": "https://cms-assets.youmind.com/media/1763886933714_5zqn1e_G6QBjQHbgAE3Yt_.jpg",
    "referenceImageUrls": [
      "https://cms-assets.youmind.com/media/1763886933714_5zqn1e_G6QBjQHbgAE3Yt_.jpg",
      "https://cms-assets.youmind.com/media/1763886938314_wbcfc7_G6QBiiracAInQ8z.jpg",
      "https://cms-assets.youmind.com/media/1763886941069_1d9ace_G6QBii_acAIRxKd.jpg",
      "https://cms-assets.youmind.com/media/1763886946388_nwahev_G6QBikOaEAAmYkO.jpg"
    ],
    "tags": [
      "nano-banana-pro",
      "Nicolechan"
    ],
    "author": "Nicolechan",
    "sourceUrl": "https://x.com/stark_nico99/status/1991718646570426763",
    "createdAt": "2025-11-21",
    "imageMode": "",
    "imageModel": "nano-banana-pro"
  },
  {
    "id": "youmind-nano-banana-pro:1b4a7a1af622c8ad",
    "sourceId": "youmind-nano-banana-pro",
    "title": "高级液态玻璃 Bento 网格产品信息图，含 8 个模块",
    "prompt": "输入变量：[插入产品名称]\n语言：[插入语言]\n\n系统指令：\n创建一个包含 8 个模块（卡片 2 到 8 只显示文本标题）的优质液态玻璃 Bento 网格产品信息图。\n1) 产品分析：\n→ 识别产品的主导自然色 → “主色调”\n→ 识别类别：食品 / 药品 / 科技\n2) 调色板（源自主色调）：\n→ 产品 + 强调色：完全饱和的主色调\n→ 图标、边框：柔和的主色调（30-40% 饱和度，绝不使用黑色）\n3) 视觉风格：\n→ 主打产品：真实摄影（真实、优质）、3D 玻璃版本 [二选一]\n→ 卡片：Apple 液态玻璃（85-90% 透明），带有极细边框和微妙的阴影，营造浮动深度并反射背景颜色\n→ 背景保持在卡片后面，卡片所在区域高度模糊 [二选一]：\n  - 飘渺：产品精髓、柔和的焦散、抽象的光晕\n  - 微距：产品纹理特写、高度模糊\n  - 图案：产品柔和重复，不透明度为 10-15%\n  - 情境：相关环境，模糊 + 去饱和\n→ 添加微妙的动态效果\n→ 不对称 Bento 网格，16:9 横向\n→ 主卡片：28-30% | 信息模块：70-72%\n4) 模块内容（8 张卡片）：\nM1 — 主打：以真实照片 / 3D 玻璃 / 风格化诠释（三选一）的精美形式展示产品 + 产品名称标签\nM2 — 核心优势：4 个独特优势 + 主色调图标\nM3 — 使用方法：4 种使用方法 + 图标\nM4 — 关键指标：5 个精确数据点\n格式：[图标] [标签] [粗体值] [单位]\n食品：卡路里：[X] 千卡/100 克，碳水化合物：[X] 克（膳食纤维 [X] 克，糖 [X] 克），蛋白质：[X] 克，[关键维生素]：[X] 毫克（每日摄入量 [X]%），[关键矿物质]：[X] 毫克（每日摄入量 [X]%）\n药品：活性成分：[名称]，强度：[X] 毫克，起效时间：[X] 分钟，持续时间：[X] 小时，半衰期：[X] 小时\n科技：芯片：[型号]，电池续航：[X] 小时，重量：[X] 克，[关键规格]：[值]，连接性：[协议]\nM5 — 适用人群：4 组推荐人群，带有绿色对勾图标 | 3 组注意事项人群，带有琥珀色警告图标\nM6 — 重要提示：4 项注意事项 + 警告图标\nM7 — 快速参考：\n→ 食品：血糖指数 + 带有图标的膳食标签\n→ 药品：副作用 + 严重程度，带有图标\n→ 科技：兼容性 + 认证，带有图标\nM8 — 你知道吗：3 个事实（起源、科学、全球统计数据）+ 图标\n输出：1 张图片，16:9 横向，超优质液态玻璃信息图。",
    "description": "使用 bento grid 8 模块布局创建信息图，用户可以指定食品、药品、科技等类别中的任何产品名称，选择语言、背景样式和主网格样式。",
    "coverUrl": "https://cms-assets.youmind.com/media/1768962051381_l9uih4_537980579-6f29d32a-c786-40c4-bd5a-79c640737496.png",
    "referenceImageUrls": [
      "https://cms-assets.youmind.com/media/1768962051381_l9uih4_537980579-6f29d32a-c786-40c4-bd5a-79c640737496.png",
      "https://cms-assets.youmind.com/media/1768962076321_nu4c5q_537981099-d18d0e38-f7ac-4781-a5da-6d68e2380885.png"
    ],
    "tags": [
      "nano-banana-pro",
      "Mansi Sanghani"
    ],
    "author": "Mansi Sanghani",
    "sourceUrl": "https://x.com/MansiSanghani1/status/2013550795224961492",
    "createdAt": "2026-01-20",
    "imageMode": "",
    "imageModel": "nano-banana-pro"
  },
  {
    "id": "youmind-nano-banana-pro:e6143ef2a0f1b41a",
    "sourceId": "youmind-nano-banana-pro",
    "title": "手绘风格标题图片提示（来自照片）",
    "prompt": "完全重塑上传的人物。\n将其作为一篇笔记文章的标题图片，该人物在文章中介绍“Nano Banana Pro”。\n长宽比：横向 16:9。\n风格和颜色：简洁、手绘风格、斜体，带有蓝绿色渐变。\n标题文字：“深入解读 Google 全新 AI ‘Nano Banana Pro’”。",
    "description": "手绘风格的头部图片，描绘一个人正在介绍 Nano Banana Pro。",
    "coverUrl": "https://cms-assets.youmind.com/media/1763885651870_4szbai_G6VZiROagAAqsIh.jpg",
    "referenceImageUrls": [
      "https://cms-assets.youmind.com/media/1763885651870_4szbai_G6VZiROagAAqsIh.jpg",
      "https://cms-assets.youmind.com/media/1763885654537_qf6h9o_G6VZiRWaIAA_9x5.jpg"
    ],
    "tags": [
      "nano-banana-pro",
      "セミナー講師専門AIコンシェルジュ｜工藤 晶"
    ],
    "author": "セミナー講師専門AIコンシェルジュ｜工藤 晶",
    "sourceUrl": "https://x.com/akirakudo_ai/status/1992096860765561190",
    "createdAt": "2025-11-22",
    "imageMode": "",
    "imageModel": "nano-banana-pro"
  },
  {
    "id": "youmind-nano-banana-pro:5a3b0d1520621629",
    "sourceId": "youmind-nano-banana-pro",
    "title": "德国水彩地图，附带各州名称",
    "prompt": "生成一张水彩风格的德国地图，并在地图上用圆珠笔标出所有联邦州。",
    "description": "一个德语提示，用于生成一张水彩风格的德国地图，其中所有联邦州都用圆珠笔标注，适用于教育或信息图表风格的地图。",
    "coverUrl": "https://cms-assets.youmind.com/media/1763886061720_fzgqaq_G6RIeSZXgAA7cOf.jpg",
    "referenceImageUrls": [
      "https://cms-assets.youmind.com/media/1763886061720_fzgqaq_G6RIeSZXgAA7cOf.jpg"
    ],
    "tags": [
      "nano-banana-pro",
      "Florian Gallwitz"
    ],
    "author": "Florian Gallwitz",
    "sourceUrl": "https://x.com/FlorianGallwitz/status/1991796624646091091",
    "createdAt": "2025-11-21",
    "imageMode": "",
    "imageModel": "nano-banana-pro"
  },
  {
    "id": "youmind-nano-banana-pro:b5767772f2d20811",
    "sourceId": "youmind-nano-banana-pro",
    "title": "元旦特辑：2026 祝福四格拼图",
    "prompt": "[关键：保持精确的面部特征，保留原始面部结构，图像中的人物必须与上传的参考图像完全一致] 高端照相馆 2x2 网格照片。左上角面板（海军蓝背景）：人物身穿海军蓝制服式连衣裙，饰有金色纽扣，复古卷发，戴蓝色贝雷帽和珍珠耳环。她双手举起一块巨大的拼图（左上角拼图，上面有数字“20”），将其移向画面中心。她的目光聚焦在中央拼图区域，表情严肃，略带微笑。背景是海军条纹、一个锚和文字“扬帆新年”。右上角面板（樱花粉背景）：同一位女士身穿粉色蕾丝连衣裙，戴珍珠项链，公主发型，戴粉色玫瑰发夹和水晶耳环。她双手举起右上角拼图（上面有数字“26”），将其移向中心，与左上角拼图连接。她的目光看向拼图接缝处，表情专注而期待，身体前倾。背景是粉色樱花、文字“美丽邂逅”、蝴蝶和花瓣。左下角面板（薄荷绿背景）：同一位女士身穿薄荷绿棉麻连衣裙，艺术风格，自然长发，戴绿色发带和木质耳环。她双手举起左下角拼图（上面有文字“元旦”），将其向上移动，与左上角拼图连接。她的目光看向拼图，表情严肃，嘴唇微抿。背景是绿色植物、文字“希望生长”、新芽和树叶。右下角面板（柠檬黄背景）：同一位女士身穿带有向日葵图案的黄色连衣裙，扎着黄色蝴蝶结的辫子。她将最后一块右下角拼图（上面有文字“快乐”）推入，完成拼图。四块拼图完美地在画面中心形成了完整的图案“2026 元旦快乐”。她向后仰头，看着完成的拼图，脸上洋溢着成功喜悦的笑容。画面中心爆发出金色光芒和五彩纸屑。背景是黄色太阳、文字“圆满成功”、笑脸和向日葵。拼图从四个角落汇聚到中心，形成一幅完整的画面。清晰的妆容，明亮的环形灯，85mm 镜头，f/1.8 光圈，四格构图，拼图互动，时尚杂志风格。",
    "description": "这是一个为 Nano Banana Pro 设计的详细多面板提示，用于创建一个 2x2 网格照片拼贴画。画面中，一位女性角色身着四套不同的服装，在四个不同的场景中拼凑一个拼图，拼图的中心显示“2026 新年快乐”。该提示详细说明了面部特征的精确保留、服装细节、背景元素以及时尚杂志风格的照片参数。",
    "coverUrl": "https://cms-assets.youmind.com/media/1767455034932_ivuvu0_G9V-MszakAEAIBw.jpg",
    "referenceImageUrls": [
      "https://cms-assets.youmind.com/media/1767455034932_ivuvu0_G9V-MszakAEAIBw.jpg"
    ],
    "tags": [
      "nano-banana-pro",
      "松果先森"
    ],
    "author": "松果先森",
    "sourceUrl": "https://x.com/songguoxiansen/status/2005822648027091031",
    "createdAt": "2025-12-30",
    "imageMode": "",
    "imageModel": "nano-banana-pro"
  },
  {
    "id": "youmind-nano-banana-pro:c2056b637f155611",
    "sourceId": "youmind-nano-banana-pro",
    "title": "一项发明的复古专利文件",
    "prompt": "一份关于 {argument name=\"invention\" default=\"INVENTION\"} 的复古专利文件，其风格仿照 19 世纪末美国专利局的备案文件。页面上印有精确的技术图纸，并带有编号标注（图 1、图 2、图 3），展示了正面、侧面和分解视图。钢笔墨水手写批注描述了机械装置。纸张呈陈旧的象牙色，带有锈斑和柔和的折痕。角落处有一个官方浮雕印章和红色蜡封。底部有发明者的手写签名和日期。整个图像给人一种从档案中找回的权威、历史且略带神秘感的文件之感。",
    "description": "一个旨在生成 19 世纪末美国复古专利文件图像的提示。它指定了精确的技术图纸、手写注释、陈旧的纸张纹理、锈斑、浮雕印章和蜡封等细节，非常适合历史或档案美学。",
    "coverUrl": "https://cms-assets.youmind.com/media/1766940094520_1mg5pd_G8_m2ZVWEAAMG7y.jpg",
    "referenceImageUrls": [
      "https://cms-assets.youmind.com/media/1766940094520_1mg5pd_G8_m2ZVWEAAMG7y.jpg",
      "https://cms-assets.youmind.com/media/1766940095035_8t8iil_G8_mW4FWwAEwERE.jpg",
      "https://cms-assets.youmind.com/media/1766940095188_kt8ksq_G8_m_7hWoAAw19u.jpg",
      "https://cms-assets.youmind.com/media/1766940096864_fhv4oo_G8_nePrXUAAHvgn.jpg"
    ],
    "tags": [
      "nano-banana-pro",
      "Alexandra Aisling"
    ],
    "author": "Alexandra Aisling",
    "sourceUrl": "https://x.com/AllaAisling/status/2004212035333365763",
    "createdAt": "2025-12-25",
    "imageMode": "",
    "imageModel": "nano-banana-pro"
  },
  {
    "id": "youmind-nano-banana-pro:8bb87fff7858a4aa",
    "sourceId": "youmind-nano-banana-pro",
    "title": "黑板风格的 AI 新闻摘要",
    "prompt": "使用以下内容，以黑板风格、手写体的外观总结新闻，并像老师写的一样，用图表和易于理解的表达方式进行分解。\n—-\nGrok 的搜索结果",
    "description": "一个日文提示，用于将 AI 新闻内容转化为手绘的、教师风格的黑板图，并附带解释。",
    "coverUrl": "https://cms-assets.youmind.com/media/1763885620059_vzaj75_G6WfVvIbAAEgvYg.jpg",
    "referenceImageUrls": [
      "https://cms-assets.youmind.com/media/1763885620059_vzaj75_G6WfVvIbAAEgvYg.jpg",
      "https://cms-assets.youmind.com/media/1763885622901_pk1vka_G6P2CkracAINIfP.jpg"
    ],
    "tags": [
      "nano-banana-pro",
      "ひでもん | AI開発@ニュース発信"
    ],
    "author": "ひでもん | AI開発@ニュース発信",
    "sourceUrl": "https://x.com/okknews/status/1992173611520868372",
    "createdAt": "2025-11-22",
    "imageMode": "",
    "imageModel": "nano-banana-pro"
  },
  {
    "id": "youmind-nano-banana-pro:64a2e85bcffc4766",
    "sourceId": "youmind-nano-banana-pro",
    "title": "详细的镜子自拍御宅族房间场景",
    "prompt": "### 场景\n宅男风格电脑角里的镜面自拍，蓝色调。\n\n### 主体\n* 性别表达：女性\n* 年龄：25 岁左右\n* 种族：东亚裔\n* 身材：苗条，腰部线条分明；身体比例自然\n* 肤色：浅中性色调\n* 发型：\n    * 长度：及腰长发\n    * 样式：直发，发梢微卷\n    * 颜色：中棕色\n* 姿势：\n    * 站姿：略呈对立式平衡站姿\n    * 右手：手持智能手机置于脸前（身份隐藏）\n    * 左臂：自然下垂于身体两侧\n    * 躯干：身体略微后倾；腰部和腹部露出\n* 服装：\n    * 上衣：浅蓝色短款针织开衫，上面两颗纽扣扣上；隐约可见一件蓝色法式文胸\n    * 下装：牛仔超短裤，臀部两侧各有一个蓝色缎带蝴蝶结\n    * 袜子：蓝白条纹过膝袜\n    * 配饰：一个蓝色可爱吉祥物手机壳\n\n### 环境\n* 描述：通过壁挂镜看到的卧室电脑角\n* 家具：\n    * 白色书桌\n    * 单显示器显示柔和的蓝色壁纸（无可读文本）\n    * 机械键盘，白色键帽，置于蓝色桌垫上\n    * 鼠标置于一个小型蓝色鼠标垫上\n    * 右侧的电脑主机，带有蓝色机箱灯\n    * 电脑主机上或附近有三个动漫手办\n    * 墙上有一张宝塔海报\n    * 猫形台灯，带蓝色点缀\n    * 一杯透明玻璃水\n    * 窗边有一株高大的绿色阔叶植物（画面左侧）\n* 颜色替换：将所有原为粉色的元素（衣服和房间装饰）替换为蓝色调（从婴儿蓝到天蓝色/长春花蓝）。\n\n### 灯光\n* 光源：来自相机左侧大窗户的日光，透过薄纱窗帘\n* 光线质量：柔和、漫射光\n* 白平衡 (K)：5200\n\n### 相机\n* 模式：智能手机后置摄像头通过镜子拍摄（无人像/散景模式）\n* 等效焦距 (mm)：26\n* 距离 (m)：\n    * 主体到镜子：0.6\n    * 相机到镜子：0.5\n* 曝光：\n    * 光圈 (f)：1.8\n    * ISO：100\n    * 快门速度 (s)：0.01\n    * 曝光补偿 (EV)：-0.3\n* 对焦：对焦于镜面图像中的躯干和短裤\n* 景深：智能手机自然的深景深；背景清晰可见，无人工模糊\n* 构图：\n    * 宽高比：1:1\n    * 裁剪：从头顶到大腿中部；画面中包含书桌、显示器、电脑主机和植物\n    * 角度：从镜子的视角看，略微高角度\n    * 构图说明：主体居中；为避免广角边缘畸变，让她站得稍远一些，之后再裁剪成正方形。\n\n### 负面提示\n* 任何地方出现粉色/洋红色\n* 美颜滤镜/过度平滑的皮肤；无毛孔皮肤外观\n* 夸张或扭曲的解剖结构\n* 不雅内容、透视织物、走光\n* 标志、品牌名称或可读的用户界面文本\n* 虚假的人像模式模糊、CGI/插画感",